{
  "$schema": "./rev_a_package.schema.json",
  "schema_version": 1,
  "release_id": "LCA1-S0-REV-A",
  "package_status": "provisional_pending_vendor_confirmation",
  "as_of": "2026-08-13",
  "source_shell": {
    "name": "OpenFrame",
    "repository": "https://github.com/chipfoundry/openframe_user_project",
    "commit": "ca732a645568d89efc9db3052eadeca47c60cf4d",
    "wrapper": "verilog/rtl/openframe_project_wrapper.v",
    "datasheet": "https://github.com/chipfoundry/openframe_user_project/blob/ca732a645568d89efc9db3052eadeca47c60cf4d/docs/caravel_openframe_datasheet.pdf"
  },
  "package": {
    "family": "QFN",
    "pin_count": 64,
    "body_mm": [9.0, 9.0],
    "pitch_mm": 0.5,
    "exposed_paddle": "VSS",
    "view": "top",
    "vendor_delivery": {
      "packaged_parts": 100,
      "m2_assemblies": 10,
      "evaluation_boards": 1
    },
    "source_errata": [
      "The datasheet Figure 2 maps QFN pin 31 to gpio[0] and pin 38 to vssa1. The later text table also maps pin 31 to gpio[0] but incorrectly lists vssa1 as pins 31 and 52. This manifest follows Figure 2 and blocks freeze until ChipFoundry confirms the correction."
    ]
  },
  "qfn_pinout": [
    {"pin": "1", "name": "vssa2", "role": "ground", "nominal_voltage": "0V", "notes": "User area 2 analog ground; exact board tie per vendor drawing."},
    {"pin": "2", "name": "gpio[25]", "role": "digital_io", "nominal_voltage": "3.3V_IO", "notes": "LCA req_ready."},
    {"pin": "3", "name": "gpio[26]", "role": "digital_io", "nominal_voltage": "3.3V_IO", "notes": "LCA req_write."},
    {"pin": "4", "name": "gpio[27]", "role": "digital_io", "nominal_voltage": "3.3V_IO", "notes": "LCA req_last."},
    {"pin": "5", "name": "gpio[28]", "role": "digital_io", "nominal_voltage": "3.3V_IO", "notes": "LCA rsp_valid."},
    {"pin": "6", "name": "gpio[29]", "role": "digital_io", "nominal_voltage": "3.3V_IO", "notes": "LCA rsp_ready."},
    {"pin": "7", "name": "gpio[30]", "role": "digital_io", "nominal_voltage": "3.3V_IO", "notes": "LCA rsp_last."},
    {"pin": "8", "name": "gpio[31]", "role": "digital_io", "nominal_voltage": "3.3V_IO", "notes": "LCA irq."},
    {"pin": "9", "name": "vdda2", "role": "power", "nominal_voltage": "3.3V", "notes": "User area 2 analog supply; treatment requires vendor confirmation."},
    {"pin": "10", "name": "vssd2", "role": "ground", "nominal_voltage": "0V", "notes": "User area 2 digital ground."},
    {"pin": "11", "name": "gpio[32]", "role": "digital_io", "nominal_voltage": "3.3V_IO", "notes": "LCA tamper_n."},
    {"pin": "12", "name": "gpio[33]", "role": "digital_io", "nominal_voltage": "3.3V_IO", "notes": "LCA zeroize_req."},
    {"pin": "13", "name": "gpio[34]", "role": "digital_io", "nominal_voltage": "3.3V_IO", "notes": "LCA busy."},
    {"pin": "14", "name": "gpio[35]", "role": "digital_io", "nominal_voltage": "3.3V_IO", "notes": "LCA fault."},
    {"pin": "15", "name": "gpio[36]", "role": "digital_io", "nominal_voltage": "3.3V_IO", "notes": "LCA zeroize_busy."},
    {"pin": "16", "name": "gpio[37]", "role": "digital_io", "nominal_voltage": "3.3V_IO", "notes": "LCA selftest_fail."},
    {"pin": "17", "name": "vddio", "role": "power", "nominal_voltage": "3.3V", "notes": "ESD and padframe power."},
    {"pin": "18", "name": "vccd", "role": "power", "nominal_voltage": "1.8V", "notes": "Common 1.8V domain; datasheet calls this unused supply domain, vendor tie required."},
    {"pin": "19", "name": "N/C", "role": "no_connect", "nominal_voltage": "none", "notes": "Do not connect unless a current vendor drawing says otherwise."},
    {"pin": "20", "name": "vssa", "role": "ground", "nominal_voltage": "0V", "notes": "Analog ground."},
    {"pin": "21", "name": "resetb", "role": "digital_input", "nominal_voltage": "3.3V_IO", "notes": "OpenFrame master reset, active low; board must define a fail-safe reset state."},
    {"pin": "22", "name": "gpio[38]", "role": "digital_io", "nominal_voltage": "3.3V_IO", "notes": "LCA host_clk."},
    {"pin": "23", "name": "vssd", "role": "ground", "nominal_voltage": "0V", "notes": "Common digital ground; datasheet calls this unused supply domain, vendor tie required."},
    {"pin": "24", "name": "gpio[39]", "role": "digital_io", "nominal_voltage": "3.3V_IO", "notes": "Reserved and disabled in Rev-A."},
    {"pin": "25", "name": "gpio[40]", "role": "digital_io", "nominal_voltage": "3.3V_IO", "notes": "Reserved and disabled in Rev-A."},
    {"pin": "26", "name": "gpio[41]", "role": "digital_io", "nominal_voltage": "3.3V_IO", "notes": "Reserved and disabled in Rev-A."},
    {"pin": "27", "name": "gpio[42]", "role": "digital_io", "nominal_voltage": "3.3V_IO", "notes": "Reserved and disabled in Rev-A."},
    {"pin": "28", "name": "gpio[43]", "role": "digital_io", "nominal_voltage": "3.3V_IO", "notes": "Reserved and disabled in Rev-A."},
    {"pin": "29", "name": "vssio", "role": "ground", "nominal_voltage": "0V", "notes": "ESD and padframe ground."},
    {"pin": "30", "name": "vdda", "role": "power", "nominal_voltage": "3.3V", "notes": "Analog supply; exact board tie per vendor drawing."},
    {"pin": "31", "name": "gpio[0]", "role": "digital_io", "nominal_voltage": "3.3V_IO", "notes": "LCA host_d[0]; Figure 2 controls over conflicting vssa1 text row."},
    {"pin": "32", "name": "gpio[1]", "role": "digital_io", "nominal_voltage": "3.3V_IO", "notes": "LCA host_d[1]."},
    {"pin": "33", "name": "gpio[2]", "role": "digital_io", "nominal_voltage": "3.3V_IO", "notes": "LCA host_d[2]."},
    {"pin": "34", "name": "gpio[3]", "role": "digital_io", "nominal_voltage": "3.3V_IO", "notes": "LCA host_d[3]."},
    {"pin": "35", "name": "gpio[4]", "role": "digital_io", "nominal_voltage": "3.3V_IO", "notes": "LCA host_d[4]."},
    {"pin": "36", "name": "gpio[5]", "role": "digital_io", "nominal_voltage": "3.3V_IO", "notes": "LCA host_d[5]."},
    {"pin": "37", "name": "gpio[6]", "role": "digital_io", "nominal_voltage": "3.3V_IO", "notes": "LCA host_d[6]."},
    {"pin": "38", "name": "vssa1", "role": "ground", "nominal_voltage": "0V", "notes": "User area 1 analog ground; Figure 2 controls over conflicting text row."},
    {"pin": "39", "name": "vssd1", "role": "ground", "nominal_voltage": "0V", "notes": "Rev-A user-area digital ground."},
    {"pin": "40", "name": "vdda1", "role": "power", "nominal_voltage": "3.3V", "notes": "User area 1 analog supply; exact board tie per vendor drawing."},
    {"pin": "41", "name": "gpio[7]", "role": "digital_io", "nominal_voltage": "3.3V_IO", "notes": "LCA host_d[7]."},
    {"pin": "42", "name": "gpio[8]", "role": "digital_io", "nominal_voltage": "3.3V_IO", "notes": "LCA host_d[8]."},
    {"pin": "43", "name": "gpio[9]", "role": "digital_io", "nominal_voltage": "3.3V_IO", "notes": "LCA host_d[9]."},
    {"pin": "44", "name": "gpio[10]", "role": "digital_io", "nominal_voltage": "3.3V_IO", "notes": "LCA host_d[10]."},
    {"pin": "45", "name": "gpio[11]", "role": "digital_io", "nominal_voltage": "3.3V_IO", "notes": "LCA host_d[11]."},
    {"pin": "46", "name": "gpio[12]", "role": "digital_io", "nominal_voltage": "3.3V_IO", "notes": "LCA host_d[12]."},
    {"pin": "47", "name": "vdda1", "role": "power", "nominal_voltage": "3.3V", "notes": "Second user area 1 analog supply pin."},
    {"pin": "48", "name": "gpio[13]", "role": "digital_io", "nominal_voltage": "3.3V_IO", "notes": "LCA host_d[13]."},
    {"pin": "49", "name": "vccd1", "role": "power", "nominal_voltage": "1.8V", "notes": "Rev-A user-area core supply."},
    {"pin": "50", "name": "gpio[14]", "role": "digital_io", "nominal_voltage": "3.3V_IO", "notes": "LCA host_d[14]."},
    {"pin": "51", "name": "gpio[15]", "role": "digital_io", "nominal_voltage": "3.3V_IO", "notes": "LCA host_d[15]."},
    {"pin": "52", "name": "vssa1", "role": "ground", "nominal_voltage": "0V", "notes": "Second user area 1 analog ground pin."},
    {"pin": "53", "name": "gpio[16]", "role": "digital_io", "nominal_voltage": "3.3V_IO", "notes": "LCA host_addr[0]."},
    {"pin": "54", "name": "gpio[17]", "role": "digital_io", "nominal_voltage": "3.3V_IO", "notes": "LCA host_addr[1]."},
    {"pin": "55", "name": "gpio[18]", "role": "digital_io", "nominal_voltage": "3.3V_IO", "notes": "LCA host_addr[2]."},
    {"pin": "56", "name": "vssio", "role": "ground", "nominal_voltage": "0V", "notes": "Second ESD and padframe ground pin."},
    {"pin": "57", "name": "gpio[19]", "role": "digital_io", "nominal_voltage": "3.3V_IO", "notes": "LCA host_addr[3]."},
    {"pin": "58", "name": "gpio[20]", "role": "digital_io", "nominal_voltage": "3.3V_IO", "notes": "LCA host_addr[4]."},
    {"pin": "59", "name": "gpio[21]", "role": "digital_io", "nominal_voltage": "3.3V_IO", "notes": "LCA host_addr[5]."},
    {"pin": "60", "name": "gpio[22]", "role": "digital_io", "nominal_voltage": "3.3V_IO", "notes": "LCA host_addr[6]."},
    {"pin": "61", "name": "gpio[23]", "role": "digital_io", "nominal_voltage": "3.3V_IO", "notes": "LCA host_addr[7]."},
    {"pin": "62", "name": "gpio[24]", "role": "digital_io", "nominal_voltage": "3.3V_IO", "notes": "LCA req_valid."},
    {"pin": "63", "name": "vccd2", "role": "power", "nominal_voltage": "1.8V", "notes": "User area 2 1.8V supply; exact board tie per vendor drawing."},
    {"pin": "64", "name": "vddio", "role": "power", "nominal_voltage": "3.3V", "notes": "Second ESD and padframe power pin."},
    {"pin": "EP", "name": "VSS", "role": "ground_thermal", "nominal_voltage": "0V", "notes": "Exposed paddle; solder and thermal-via geometry require the current assembly drawing."}
  ],
  "logical_io": [
    {"gpio": 0, "qfn_pin": 31, "signal": "host_d[0]", "direction": "bidirectional", "dm": "110", "oeb": "dynamic_rsp_valid", "inp_dis": 0, "ib_mode_sel": 0, "vtrip_sel": 0, "slow": 1, "safe_state": "Hi-Z"},
    {"gpio": 1, "qfn_pin": 32, "signal": "host_d[1]", "direction": "bidirectional", "dm": "110", "oeb": "dynamic_rsp_valid", "inp_dis": 0, "ib_mode_sel": 0, "vtrip_sel": 0, "slow": 1, "safe_state": "Hi-Z"},